{
  "schema_version": "pandaloco-gate-result/v1",
  "matrix_version": "pandaloco-dsh-gates/v1",
  "subject": {
    "adoption_id": "pandaloco-deepseek-harness",
    "runtime_epoch": "dsh-epoch-0001",
    "candidate_manifest_reference": "pandaloco/adoption/CANDIDATE.sha256",
    "candidate_manifest_digest_sha256": "1f2bdef6579c03973dd346568dc31e821f13810e03648ef96fbe61b14a0983ba",
    "source_commit": "47f943859bef60e4160492346772ded9b24f765a",
    "source_tree": "f904efab9ef435201d6ba4da88a34d6366568272",
    "resolved_config_digest_sha256": null,
    "gate_subject_digests": [
      { "role": "candidate-subject-manifest", "digest_sha256": "1f2bdef6579c03973dd346568dc31e821f13810e03648ef96fbe61b14a0983ba" },
      { "role": "gate-matrix", "digest_sha256": "1f400aa046da7a3e623ce074b34ee8c04ad0da1fa423b95f937ae9b568a83201" }
    ]
  },
  "gate_id": "G5",
  "evaluated_at": "2026-08-15T16:41:31Z",
  "status": "pass",
  "expected_result": "candidate-subject manifest and repository hygiene reproduce",
  "actual_result": "candidate-subject manifest and repository hygiene reproduce",
  "oracle_decision": "matched",
  "evidence": [
    { "reference": "pandaloco/adoption/CANDIDATE.sha256", "digest_sha256": "1f2bdef6579c03973dd346568dc31e821f13810e03648ef96fbe61b14a0983ba" },
    { "reference": "pandaloco/adoption/gates/gate-matrix-v1.yaml", "digest_sha256": "1f400aa046da7a3e623ce074b34ee8c04ad0da1fa423b95f937ae9b568a83201" }
  ],
  "evaluator": "pandaloco-wp0-static-validator/v2",
  "failure_code": null
}
